{
  "success": false,
  "task_id": "sample-empty",
  "source": {"source_url": "https://example.org/empty", "source_name": null, "region": null, "organization": null, "column_name": null},
  "statistics": {"pages_visited": 1, "articles_discovered": 0, "articles_fetched": 0, "articles_accepted": 0, "articles_rejected": 0, "articles_pending_review": 0, "articles_failed": 0},
  "articles": [],
  "failed_urls": [],
  "warnings": ["NO_ARTICLES"],
  "workflow_version": "batch_crawl-v1",
  "started_at": "2026-08-04T09:00:00Z",
  "completed_at": "2026-08-04T09:00:02Z"
}
